{
  "$schema":"https://json-schema.org/draft/2020-12/schema","$id":"https://agent-memory.local/schemas/evidence/v1/ga-approval-export-input.schema.json","title":"Agent Memory GA approval export input","type":"object","additionalProperties":false,
  "required":["schema","classification","environment","export_id","review_id","review_policy_version","inventory_id","inventory_receipt_sha256","plan_id","plan_receipt_sha256","change_id","change_receipt_sha256","release_id","release_receipt_sha256","scorecard_id","scorecard_receipt_sha256","drill_review_id","drill_receipt_sha256","ga_evidence_bundle_sha256","trust_bundle_sha256","approval_export_sha256","domain_review_sha256","exported_at","reviewed_at","generated_at","ready","checks"],
  "properties":{"schema":{"const":"agent-memory-ga-approval-export-input-v1"},"classification":{"const":"production_external"},"environment":{"const":"production"},"export_id":{"$ref":"#/$defs/opaque"},"review_id":{"$ref":"#/$defs/opaque"},"review_policy_version":{"$ref":"#/$defs/opaque"},"inventory_id":{"$ref":"#/$defs/opaque"},"inventory_receipt_sha256":{"$ref":"#/$defs/digest"},"plan_id":{"$ref":"#/$defs/opaque"},"plan_receipt_sha256":{"$ref":"#/$defs/digest"},"change_id":{"$ref":"#/$defs/opaque"},"change_receipt_sha256":{"$ref":"#/$defs/digest"},"release_id":{"$ref":"#/$defs/opaque"},"release_receipt_sha256":{"$ref":"#/$defs/digest"},"scorecard_id":{"$ref":"#/$defs/opaque"},"scorecard_receipt_sha256":{"$ref":"#/$defs/digest"},"drill_review_id":{"$ref":"#/$defs/opaque"},"drill_receipt_sha256":{"$ref":"#/$defs/digest"},"ga_evidence_bundle_sha256":{"$ref":"#/$defs/digest"},"trust_bundle_sha256":{"$ref":"#/$defs/digest"},"approval_export_sha256":{"$ref":"#/$defs/digest"},"domain_review_sha256":{"$ref":"#/$defs/digest"},"exported_at":{"type":"string","format":"date-time"},"reviewed_at":{"type":"string","format":"date-time"},"generated_at":{"type":"string","format":"date-time"},"ready":{"type":"boolean"},"checks":{"type":"array","minItems":8,"maxItems":8,"items":{"$ref":"#/$defs/check"}}},
  "$defs":{"digest":{"type":"string","pattern":"^[a-f0-9]{64}$"},"opaque":{"type":"string","pattern":"^[A-Za-z0-9][A-Za-z0-9._:-]{0,127}$"},"check_id":{"enum":["ga_prerequisite_receipts_ready","ga_common_production_release","ga_trust_bundle_valid","ga_immutable_export_complete","ga_authorized_signatures_valid","ga_reviewed_evidence_bound","ga_approvals_current","ga_accountable_domain_review_complete"]},"check":{"type":"object","additionalProperties":false,"required":["id","outcome","evidence_sha256"],"properties":{"id":{"$ref":"#/$defs/check_id"},"outcome":{"enum":["passed","failed","inconclusive"]},"evidence_sha256":{"$ref":"#/$defs/digest"}}}}
}
