{"schema":"agent-memory-ga-approval-export-input-v1","classification":"production_external","environment":"production","export_id":"ga-approval-export-2026q4","review_id":"ga-review-2026q4","review_policy_version":"ga-review-v1","inventory_id":"production-inventory","inventory_receipt_sha256":"aaaaaaaaaaaaaaaaaaaaaaaaaaaaaaaaaaaaaaaaaaaaaaaaaaaaaaaaaaaaaaaa","plan_id":"production-plan","plan_receipt_sha256":"aaaaaaaaaaaaaaaaaaaaaaaaaaaaaaaaaaaaaaaaaaaaaaaaaaaaaaaaaaaaaaaa","change_id":"production-change","change_receipt_sha256":"aaaaaaaaaaaaaaaaaaaaaaaaaaaaaaaaaaaaaaaaaaaaaaaaaaaaaaaaaaaaaaaa","release_id":"production-release","release_receipt_sha256":"aaaaaaaaaaaaaaaaaaaaaaaaaaaaaaaaaaaaaaaaaaaaaaaaaaaaaaaaaaaaaaaa","scorecard_id":"ga-scorecard-2026q4","scorecard_receipt_sha256":"bbbbbbbbbbbbbbbbbbbbbbbbbbbbbbbbbbbbbbbbbbbbbbbbbbbbbbbbbbbbbbbb","drill_review_id":"ga-drills-2026q4","drill_receipt_sha256":"cccccccccccccccccccccccccccccccccccccccccccccccccccccccccccccccc","ga_evidence_bundle_sha256":"dddddddddddddddddddddddddddddddddddddddddddddddddddddddddddddddd","trust_bundle_sha256":"eeeeeeeeeeeeeeeeeeeeeeeeeeeeeeeeeeeeeeeeeeeeeeeeeeeeeeeeeeeeeeee","approval_export_sha256":"ffffffffffffffffffffffffffffffffffffffffffffffffffffffffffffffff","domain_review_sha256":"1111111111111111111111111111111111111111111111111111111111111111","exported_at":"2026-11-14T02:00:00Z","reviewed_at":"2026-11-14T03:00:00Z","generated_at":"2026-11-14T04:00:00Z","ready":true,"checks":[{"id":"ga_prerequisite_receipts_ready","outcome":"passed","evidence_sha256":"aaaaaaaaaaaaaaaaaaaaaaaaaaaaaaaaaaaaaaaaaaaaaaaaaaaaaaaaaaaaaaaa"},{"id":"ga_common_production_release","outcome":"passed","evidence_sha256":"aaaaaaaaaaaaaaaaaaaaaaaaaaaaaaaaaaaaaaaaaaaaaaaaaaaaaaaaaaaaaaaa"},{"id":"ga_trust_bundle_valid","outcome":"passed","evidence_sha256":"aaaaaaaaaaaaaaaaaaaaaaaaaaaaaaaaaaaaaaaaaaaaaaaaaaaaaaaaaaaaaaaa"},{"id":"ga_immutable_export_complete","outcome":"passed","evidence_sha256":"aaaaaaaaaaaaaaaaaaaaaaaaaaaaaaaaaaaaaaaaaaaaaaaaaaaaaaaaaaaaaaaa"},{"id":"ga_authorized_signatures_valid","outcome":"passed","evidence_sha256":"aaaaaaaaaaaaaaaaaaaaaaaaaaaaaaaaaaaaaaaaaaaaaaaaaaaaaaaaaaaaaaaa"},{"id":"ga_reviewed_evidence_bound","outcome":"passed","evidence_sha256":"aaaaaaaaaaaaaaaaaaaaaaaaaaaaaaaaaaaaaaaaaaaaaaaaaaaaaaaaaaaaaaaa"},{"id":"ga_approvals_current","outcome":"passed","evidence_sha256":"aaaaaaaaaaaaaaaaaaaaaaaaaaaaaaaaaaaaaaaaaaaaaaaaaaaaaaaaaaaaaaaa"},{"id":"ga_accountable_domain_review_complete","outcome":"passed","evidence_sha256":"aaaaaaaaaaaaaaaaaaaaaaaaaaaaaaaaaaaaaaaaaaaaaaaaaaaaaaaaaaaaaaaa"}]}
